{
  "schemaVersion": 1,
  "decisionId": "decision-jira-status-reminder-1",
  "eventId": "evt-jira-status-reminder-1",
  "decidedAt": "2026-07-24T20:20:01Z",
  "policyVersion": "loop-guard-v0.1",
  "loopAssessment": {
    "classification": "none",
    "recurrenceCount": 0,
    "recommendation": "continue"
  },
  "routes": [
    {
      "destination": "jira",
      "action": "append",
      "target": "AEPI-10:comments",
      "reasonCode": "first-coordination-message",
      "rationale": "No equivalent action exists in the current causal chain.",
      "idempotencyKey": "evt-jira-status-reminder-1:jira:append:AEPI-10-comments",
      "actionFingerprint": "jira:append:AEPI-10-comments:post-unchanged-status-reminder",
      "approval": {
        "required": false,
        "status": "not-required"
      }
    }
  ]
}
