{
  "schemaVersion": 1,
  "decisionId": "decision-case-study-category-removal",
  "eventId": "evt-case-study-category-removal",
  "decidedAt": "2026-07-24T20:00:01Z",
  "policyVersion": "loop-guard-v0.1",
  "loopAssessment": {
    "classification": "none",
    "recurrenceCount": 0,
    "recommendation": "continue"
  },
  "routes": [
    {
      "destination": "telemetry",
      "action": "create",
      "target": "routing-events",
      "reasonCode": "measure-routing",
      "rationale": "Retain the routing outcome for later effectiveness analysis.",
      "idempotencyKey": "evt-case-study-category-removal:telemetry:create",
      "actionFingerprint": "telemetry:create:routing-event",
      "approval": {
        "required": false,
        "status": "not-required"
      }
    },
    {
      "destination": "knowledge-base",
      "action": "append",
      "target": "personal/implementation-records/audience-first-knowledge-tree-migration-2026-07-24.md",
      "reasonCode": "same-outcome-boundary",
      "rationale": "The category removal refines the same taxonomy outcome and rollback boundary.",
      "idempotencyKey": "evt-case-study-category-removal:knowledge-base:append:audience-first-tree",
      "actionFingerprint": "knowledge-base:append:audience-first-tree:remove-case-study-category",
      "approval": {
        "required": false,
        "status": "not-required"
      }
    },
    {
      "destination": "jira",
      "action": "suppress",
      "reasonCode": "no-coordination-needed",
      "rationale": "The completed refinement has no remaining owner, approval, or delivery state to coordinate.",
      "approval": {
        "required": false,
        "status": "not-required"
      }
    },
    {
      "destination": "confluence",
      "action": "suppress",
      "reasonCode": "no-new-shared-decision",
      "rationale": "The refinement does not create a durable shared architecture decision.",
      "approval": {
        "required": false,
        "status": "not-required"
      }
    }
  ]
}
