{
  "schemaVersion": 1,
  "decisionId": "decision-jira-status-reminder-2",
  "eventId": "evt-jira-status-reminder-2",
  "decidedAt": "2026-07-24T20:20:06Z",
  "policyVersion": "loop-guard-v0.1",
  "loopAssessment": {
    "classification": "semantic-recurrence",
    "recurrenceCount": 1,
    "recommendation": "replan",
    "matchedEventId": "evt-jira-status-reminder-1"
  },
  "routes": [
    {
      "destination": "jira",
      "action": "suppress",
      "target": "AEPI-10:comments",
      "reasonCode": "semantic-recurrence",
      "rationale": "A different event in the same causal chain has the same normalized destination intent.",
      "idempotencyKey": "evt-jira-status-reminder-2:jira:append:AEPI-10-comments",
      "actionFingerprint": "jira:append:AEPI-10-comments:post-unchanged-status-reminder",
      "approval": {
        "required": false,
        "status": "not-required"
      }
    }
  ]
}
